,tweetID,tweetText,tweetRetweetCt,tweetFavoriteCt,tweetSource,tweetCreated,userID,userScreen,userName,userCreateDt,userDesc,userFollowerCt,userFriendsCt,userLocation,userTimezone
0,692859686467432448,"RT @DocTexian: Fox News:
HILLARY CLINTON WILL BE THE NEXT PRESIDENT OF THE UNITED STATES OF AMERICA BUT SHOULD ONLY BE PAID 82 % OF OTHER P…",101,0,Twitter Web Client,2016-01-28 23:59:56,3138719852,mcclard_nadia,Nadia Mcclard,2015-04-04 09:02:26,Always be kinder than you feel,3012,1593,New York,
1,692857702616158209,"#HillYes #ImWithHer  #WeWillNotBeErased
We can overlook some corruption in a #Clinton https://t.co/uVQXOsQdpa",3,2,Twitter for Android,2016-01-28 23:52:03,2250817146,BoonieKane,Beckie,2013-12-17 18:43:03,"Women's Rights/Equality Environment #Bernified twitmo alumni & snarky
GET #KochSuckas OUT of OUR GOVERNMENT #UniteBlue",5094,5503,"Goodells,MI",
2,692857487322537985,"RT @TotalTrafficHOU: Stall cleared in #SeSide on 610 S Lp WB at The 45 Gulf Fwy, stop and go traffic back to Clinton, delay of 8 mins #traf…",1,0,(TX) I-45 Updates,2016-01-28 23:51:12,164324027,TXI45thm,The Highway Monitor,2010-07-08 16:00:17,This feed provides timely #interstate #traffic info & RT's for I-45 in #TX. Pre-plan your trip or use a text reader on the go. Stop Distracted Driving!,296,195,"Texas, USA",Mountain Time (US & Canada)
3,692857165434892289,"Stall cleared in #SeSide on 610 S Lp WB at The 45 Gulf Fwy, stop and go traffic back to Clinton, delay of 8 mins #traffic",1,1,TTN HOU traffic,2016-01-28 23:49:55,249818911,TotalTrafficHOU,TTN Houston,2011-02-09 21:09:17,Your #1 stop for all your Houston Traffic needs! See a #Traffic issue?  Tweet us or call us on the tip line at 281- 214-0440 #HoustonTexans #HoustonAstros,1027,112,"Houston, TX",Central Time (US & Canada)
4,692854303162179584,"Seasons almost here gonna miss playing as a big red❤️⚽️🏆 @ Clinton,… https://t.co/oRbLePUJQ9",0,0,Instagram,2016-01-28 23:38:33,765919220,berta8121,Berta,2012-08-18 15:44:30,"Sometimes I feel like giving up, Then I remember I have a lot of you motherfuckers to prove wrong. Ink addiction. SWOSU . SC: robertlg IG: berta8121",498,486,"Weatherford, OK",
5,692853679402057728,"RT @TotalTrafficHOU: Car fire cleared in #SeSide on 610 S Lp WB at The 45 Gulf Fwy, stop and go traffic back to Clinton, delay of 8 mins #t…",1,0,RoundTeam,2016-01-28 23:36:04,164287336,TXI10thm,The Highway Monitor,2010-07-08 14:11:27,This feed provides timely #interstate #traffic info & RT's for I-10 in #TX. Pre-plan your trip or use a text reader on the go. Stop Distracted Driving!,436,225,"Texas, USA",Mountain Time (US & Canada)
6,692852481240408066,"Car fire cleared in #SeSide on 610 S Lp WB at The 45 Gulf Fwy, stop and go traffic back to Clinton, delay of 8 mins #traffic",1,0,TTN HOU traffic,2016-01-28 23:31:18,249818911,TotalTrafficHOU,TTN Houston,2011-02-09 21:09:17,Your #1 stop for all your Houston Traffic needs! See a #Traffic issue?  Tweet us or call us on the tip line at 281- 214-0440 #HoustonTexans #HoustonAstros,1027,112,"Houston, TX",Central Time (US & Canada)
7,692850124016357380,"Stall blocks a center lane in #SeSide on 610 S Lp WB at The 45 Gulf Fwy, stop and go traffic back to Clinton, delay of 8 mins #traffic",0,0,TTN HOU traffic,2016-01-28 23:21:56,249818911,TotalTrafficHOU,TTN Houston,2011-02-09 21:09:17,Your #1 stop for all your Houston Traffic needs! See a #Traffic issue?  Tweet us or call us on the tip line at 281- 214-0440 #HoustonTexans #HoustonAstros,1027,112,"Houston, TX",Central Time (US & Canada)
8,692850070648008704,"RT @HercFamily5: @mlcalderone as a die hard conservative, Trump will insist his buddy Bill Clinton moderate it.",7,0,Twitter Web Client,2016-01-28 23:21:44,2959785818,peggenze,Peg E,2015-01-05 14:51:13,When a President can pick and choose which laws to follow and which to ignore he is no longer a President. Ted Cruz,1252,1317,,
9,692846242888445954,@JazzShaw Sounds like progressive writers starting to sop up the Clinton drip.drip.drip. Just another trashcan liner put to good use.,0,0,Twitter for Android,2016-01-28 23:06:31,384903586,SenatorMark4,Mark Robbins,2011-10-04 14:47:03,"Process-oriented seeker of solutions to government waste and abuse.. 
Published solutions!",90,323,"Kingsland, TX",Central Time (US & Canada)
10,692845345915580416,RT @MiryamLipper: ⌛️⏰ @ Hillary Clinton Campaign Headquarters https://t.co/uHWxHqK3AT,1,0,Twitter for iPhone,2016-01-28 23:02:57,1872073316,Sarah_L_Bard,Sarah Bard,2013-09-16 15:34:01,"Jewish Outreach Director, Hillary For America",278,524,"Brooklyn, NY",
11,692844549236850688,"Shaw Industries #Labor #Job: Grader - Saw - Rough Mill - Plant H5 - 2nd Shift (#Clinton, SC) https://t.co/BoWc0RZLjW #Jobs #Hiring",0,0,TweetMyJOBS,2016-01-28 22:59:47,119115001,tmj_SC_LABOR,TMJ-SC Labor Jobs,2010-03-02 18:25:38,Follow this account for geo-targeted General Labor job tweets in South Carolina Non-Metro from TweetMyJobs. Need help? Tweet us at @TweetMyJobs!,309,278,South Carolina,Quito
12,692842214708289537,"Join the Fresenius Medical Care team! See our latest #Nursing #job opening here: https://t.co/dFnGNAt8hy #CharterTownshipofClinton, MI",0,0,TweetMyJOBS,2016-01-28 22:50:31,22057113,tmj_mi_nursing,TMJ- MI-US Nursing,2009-02-26 20:29:30,Follow this account for geo-targeted Healthcare-Nursing job tweets in Michigan Non-Metro. Need help? Tweet us at @CareerArc!,358,296,Michigan,Eastern Time (US & Canada)
13,692841437595963393,"🍻 (@ SCS Moose Lodge #1837 in Clinton Township, MI) https://t.co/QMkLsHCRgP",0,0,Foursquare,2016-01-28 22:47:25,30773956,JacekWos,Jacek,2009-04-13 01:36:26,Just a poor and stupid mailman near Detroit.,58,162,"Clinton Twp., MI",Eastern Time (US & Canada)
14,692838533946429440,"McDonald's Corporation #Hospitality #Job: McDonald's Restaurant Careers (#CLINTON, IA) https://t.co/7Fmu0oDKJR #Jobs #Hiring #CareerArc",0,0,TweetMyJOBS,2016-01-28 22:35:53,88113990,tmj_ia_hrta,TMJ-IA HRTA Jobs,2009-11-07 04:42:24,Follow this account for geo-targeted Hospitality/Restaurant/Tourism job tweets in Iowa Non-Metro. Need help? Tweet us at @CareerArc!,351,283,Indiana,Eastern Time (US & Canada)
15,692837757534666752,Guess whose bizack @ Clinton National Airport https://t.co/Z8NS8RuaT7,0,0,Instagram,2016-01-28 22:32:48,22751254,Kwestion,King No Crown,2009-03-04 09:11:12,"#MyAlbum #OutNow #LinkRightHere https://t.co/r2WnezcAie Booking, Features, Production info@itskwestion.com #BlackKings & #BlackKweens #Matter",3804,915,#SwiLA,Central Time (US & Canada)
16,692834202790662147,@RogerJStoneJr I was concerned by W close friendship w Clinton. Also W motive 4helping WW.bothers me. Hes the one who got them injured-guilt,0,0,Twitter for Android,2016-01-28 22:18:40,2737178169,LgLgarris62,Linda g,2014-08-08 12:36:48,"christian,conservative, nurse,animal lover,pro life,walking dead fan.dislike Hollywood, msm,liberals",1490,1462,,
17,692833851308056577,"@RBReich Clinton Foundation a leading proponent of disclosure, as are Soro's fronts, to insure @realDonaldTrump honest  competition. &lt;/sarc&gt;",0,0,Twitter for Android,2016-01-28 22:17:17,384903586,SenatorMark4,Mark Robbins,2011-10-04 14:47:03,"Process-oriented seeker of solutions to government waste and abuse.. 
Published solutions!",90,323,"Kingsland, TX",Central Time (US & Canada)
18,692831678075539456,"@peddoc63 So basically, you're saying the Saudis give more to wounded warriors via Clinton than @realDonaldTrump THAT'S real!",0,0,Twitter for Android,2016-01-28 22:08:38,384903586,SenatorMark4,Mark Robbins,2011-10-04 14:47:03,"Process-oriented seeker of solutions to government waste and abuse.. 
Published solutions!",90,323,"Kingsland, TX",Central Time (US & Canada)
19,692830984581058561,"I'm at Surratts-Clinton Branch Library - @pgcmls in Clinton, MD https://t.co/UNY1setLjd",0,1,Foursquare,2016-01-28 22:05:53,49084221,Naya2000,❣Kerri Stewart❣,2009-06-20 18:59:03,"I ❤️❤️❤️to RT funny & inspirational quotes by others❣ I ❤️❤️❤️to enter & win sweepstakes❣ I'll tweet or RT contest info so you can enter, too❣ ♥Kerri♥",681,2066,20748,Eastern Time (US & Canada)
20,692829838546108416,"Join the Aerotek team! See our latest #Nursing #job opening here: https://t.co/XDTBg6vHNc #Clinton, MD #Hiring",0,0,TweetMyJOBS,2016-01-28 22:01:20,22148215,tmj_dc_nursing,TMJ-WAS Nursing Jobs,2009-02-27 15:07:40,Follow this account for geo-targeted Healthcare-Nursing job tweets in DC Metro. Need help? Tweet us at @CareerArc!,409,306,"Washington, DC",Eastern Time (US & Canada)
21,692827737191395328,⌛️⏰ @ Hillary Clinton Campaign Headquarters https://t.co/uHWxHqK3AT,1,1,Instagram,2016-01-28 21:52:59,244817600,MiryamLipper,Miryam Lipper,2011-01-30 06:00:01,HFA Surrogates Team Member and Former Deputy National Press Secretary and Director of Broadcast Media for @theDemocrats. Tweets/retweets = my own. #ImWithHer,655,1095,"Washington, DC",Central Time (US & Canada)
22,692827414854922240,"Join the SONIC Drive-In team! See our latest #Hospitality #job opening here: https://t.co/KdOtGBz7TL #Clinton, LA #Hiring",0,0,SafeTweet by TweetMyJOBS,2016-01-28 21:51:42,2924224280,SONICjobs,SONIC Jobs,2014-12-09 17:20:23,Check out our open positions to learn how you can WORK YOUR SPIRIT at #SONIC!,215,39,,
23,692826153879474178,"I'm at Classic Cuts Barbershop in Clinton, MD https://t.co/Ii4Nzt9ioK",0,1,Foursquare,2016-01-28 21:46:41,27312969,DaByrdman33,Ashley W. Byrd,2009-03-28 21:31:25,"Co-Founder & President of The B&B Cigar Club. Full-time cigar enthusiast. Clemson Tigers Football fanatic. 
WE ALL WE GOT SHEEEIIIT!",2798,2422,"38.93333333,-77.42777778",Eastern Time (US & Canada)
24,692823922140512256,"Interested in a #Hospitality #job near #Clinton, LA? This could be a great fit: https://t.co/OTGLcMAAvg #SONIC #Hiring #CareerArc",0,0,TweetMyJOBS,2016-01-28 21:37:49,88181812,tmj_la_hrta,TMJ-LA HRTA Jobs,2009-11-07 13:05:04,Follow this account for geo-targeted Hospitality/Restaurant/Tourism job tweets in Louisiana Non-Metro. Need help? Tweet us at @CareerArc!,379,282,Louisiana,Eastern Time (US & Canada)
25,692822739644715008,Things you see while shopping at Target @ Target Clinton Pointe https://t.co/OMobwyUSNe,0,0,Instagram,2016-01-28 21:33:07,49853840,csqured,Court,2009-06-23 02:20:20,Indecisive. Randomness. Geek. Sarcastic. My dogs are named after great leaders (Yoda & Izzo),160,166,"Detroit, MI",Eastern Time (US & Canada)
26,692821951568441344,"#Automotive #Job alert: Diesel Technician/Mechanic I | Penske Truck Leasing | #Clinton, PA https://t.co/6j0fEIzkPy #gopenskecareers #Jobs",0,0,TweetMyJOBS,2016-01-28 21:29:59,180060504,tmj_PA_auto,Penn. Automotive,2010-08-18 19:03:23,Follow this account for geo-targeted Automotive job tweets in Pennsylvania Non-Metro. Need help? Tweet us at @CareerArc!,180,130,Pennsylvania,Quito
27,692821777945198592,"Want to work at Speedway? We're #hiring in #Clinton, NJ! Click for details: https://t.co/JXwmcxmaGj #Retail #Job #Jobs #CareerArc",0,0,TweetMyJOBS,2016-01-28 21:29:18,59785077,tmj_nj_retail,TMJ-NJ Retail Jobs,2009-07-24 13:42:01,Follow this account for geo-targeted Retail job tweets in New Jersey Non-Metro. Need help? Tweet us at @CareerArc!,431,301,New Jersey,Central Time (US & Canada)
28,692821210380406784,"Can you recommend anyone for this #Physician #job? https://t.co/4wyU3VxrPk #CLINTON, NC #Hiring",0,0,SafeTweet by TweetMyJOBS,2016-01-28 21:27:03,1860798708,JoinTeamHealth,JoinTeamHealth,2013-09-13 14:47:56,"One of nation's largest providers of Emergency Medicine,Hospital Medicine,Anesthesia,Acute Care Surgery,OB/GYN Hospitalist & Orthopaedic Hospitalists services.",352,124,,
29,692820145912156161,"Interested in a #Retail #job near #CLINTON, OK? This could be a great fit: https://t.co/1iLfvHMGfW #Hiring #CareerArc",0,0,TweetMyJOBS,2016-01-28 21:22:49,59973116,tmj_ok_retail,TMJ-OK Retail Jobs,2009-07-25 03:53:47,Follow this account for geo-targeted Retail job tweets in Oklahoma Non-Metro. Need help? Tweet us at @CareerArc!,358,302,Oklahoma,Central Time (US & Canada)
30,692817619104043009,"Join the SONIC Drive-In team! See our latest #Hospitality #job opening here: https://t.co/8RAXqQThNo #SONIC #Clinton, MS #Hiring #CareerArc",0,0,TweetMyJOBS,2016-01-28 21:12:46,88254288,tmj_ms_hrta,TMJ-MS HRTA Jobs,2009-11-07 19:37:56,Follow this account for geo-targeted Hospitality/Restaurant/Tourism job tweets in Mississippi Non-Metro. Need help? Tweet us at @CareerArc!,364,280,Mississippi,Eastern Time (US & Canada)
31,692815860625383424,Accident in #Rochester on N Clinton Ave Both NB/SB at Upper Falls Blvd #traffic https://t.co/0wsFrmqFZG,1,0,TTN ROC traffic,2016-01-28 21:05:47,250319034,TotalTrafficROC,TTN Rochester,2011-02-10 21:26:18,Real Time Rochester area traffic provided by Total Traffic Network in Rochester NY.,668,154,"Rochester, NY",Eastern Time (US & Canada)
32,692812033516007424,"Always refreshing to spend a day in #Clinton @ Clinton, New Jersey https://t.co/BzQOLFwZVj",0,0,Instagram,2016-01-28 20:50:35,33737315,samanthajrose,beana♕♔,2009-04-21 00:35:19,,284,172,,Eastern Time (US & Canada)
33,692808020380614657,"Can you recommend anyone for this #job? Parts Delivery - https://t.co/YD0OATdtLL #CLINTON, AR #Transportation #Hiring #CareerArc",0,0,TweetMyJOBS,2016-01-28 20:34:38,149168973,tmj_AR_transp,TMJ-AR Transport.,2010-05-28 15:56:25,Follow this account for geo-targeted Transportation job tweets in Arkansas Non-Metro. Need help? Tweet us at @CareerArc!,367,280,Arkansas,Quito
34,692806145623330824,Appreciate the Clinton Community Nature Center for all their love and support this year! Really… https://t.co/luVv0I6R0M,0,0,Instagram,2016-01-28 20:27:11,2976950165,bbgunner4914,Blaire Baxter,2015-01-13 19:20:41,,15,109,"Clinton, MS",
35,692802415158898689,"Can you recommend anyone for this #Retail #job? https://t.co/k0SLeRL7f5 #Clinton, IA #Hiring #CareerArc",0,0,TweetMyJOBS,2016-01-28 20:12:22,59912224,tmj_ia_retail,TMJ-IA Retail Jobs,2009-07-24 22:57:23,Follow this account for geo-targeted Retail job tweets in Iowa Non-Metro. Need help? Tweet us at @CareerArc!,339,302,Indiana,Central Time (US & Canada)
36,692801961515552769,"We're #hiring! Read about our latest #job opening here: Parts Delivery - https://t.co/DKx9A0Rmo7 #CLINTON, TN #Transportation #CareerArc",0,0,TweetMyJOBS,2016-01-28 20:10:33,149399927,tmj_TN_transp,TMJ-TN Transport.,2010-05-29 05:35:23,Follow this account for geo-targeted Transportation job tweets in Tennessee Non-Metro. Need help? Tweet us at @CareerArc!,400,280,Tennessee,Quito
37,692801385566318592,"If you're a #Retail professional in #Clinton, NC, check out this #job: https://t.co/giSEUjP6jW #Hiring #CareerArc",0,0,TweetMyJOBS,2016-01-28 20:08:16,59967889,tmj_nc_retail,TMJ-NC Retail Jobs,2009-07-25 03:27:35,Follow this account for geo-targeted Retail job tweets in North Carolina. Need help? Tweet us at @CareerArc!,417,305,North Carolina,Central Time (US & Canada)
38,692799498939072514,"RT @HercFamily5: @mlcalderone as a die hard conservative, Trump will insist his buddy Bill Clinton moderate it.",7,0,Twitter Web Client,2016-01-28 20:00:46,18269496,mzee26,mzee26,2008-12-20 17:41:56,"Politically Independent/Conservative sports loving, reality show watching girl, Tweets are mostly political in nature, but I random tweet about anything too.",8996,9386,Texas,Central Time (US & Canada)
39,692794121291862016,"Interested in a #Education #job near #Clinton, NJ? This could be a great fit: https://t.co/w2Je3eKj2M #Hiring https://t.co/8NVZs9ACmQ",0,0,TweetMyJOBS,2016-01-28 19:39:24,4519424298,CTS_Jobs,CTS Jobs,2015-12-10 16:13:53,A nationwide #leader in #school-based #therapy #services. Now #hiring for rewarding #positions throughout the US!,6,3,United States,Central Time (US & Canada)
40,692791692651425792,Accident in #Syracuse on S Clinton St SB at W Jefferson St #traffic https://t.co/MBQubGTSI5,0,0,TTN SYR traffic,2016-01-28 19:29:45,250330008,TotalTrafficSYR,TTN Syracuse,2011-02-10 21:54:36,"See a traffic problem, accident or delay? Call our Traffic Tip Line at 315-421-1190",657,346,"Syracuse, NY",Eastern Time (US & Canada)
41,692786387628724224,"La Familia @aps_aj ❌ @twfevents @ Clinton, Maryland https://t.co/qToCdSZyeF",0,0,Instagram,2016-01-28 19:08:40,25912385,CarrieQTENT,Carrie Michelle,2009-03-23 00:07:56,"#iReport • #iHost • #iInfluence • #QTENT
 
@OfficialBeliaire #BlackBottleGirl

#TheEddieKayneTVShow @CBS46 - Feb. 5th


For Booking BookCarrieMichelle@gmail.com",14623,5443,DMV✈ATL ,Eastern Time (US & Canada)
42,692781804130992128,"Want to work in #Clinton, OK? View our latest opening: https://t.co/azFRRWriBO #Nursing #Job #Jobs #Hiring #CareerArc",0,1,TweetMyJOBS,2016-01-28 18:50:28,67489577,tmj_ok_nursing,TMJ-OK Nursing Jobs,2009-08-21 01:52:58,Follow this account for geo-targeted Healthcare-Nursing job tweets in Oklahoma Non-Metro. Need help? Tweet us at @CareerArc!,335,294,Oklahoma,Eastern Time (US & Canada)
43,692780946613874688,"Want to work in #Clinton, LA? View our latest opening: https://t.co/bqUwTsJlE2 #Hospitality #SONIC #Job #Jobs #Hiring #CareerArc",0,0,TweetMyJOBS,2016-01-28 18:47:03,88181812,tmj_la_hrta,TMJ-LA HRTA Jobs,2009-11-07 13:05:04,Follow this account for geo-targeted Hospitality/Restaurant/Tourism job tweets in Louisiana Non-Metro. Need help? Tweet us at @CareerArc!,379,282,Louisiana,Eastern Time (US & Canada)
44,692780757471727616,"If you're a #Physician professional in #CLINTON, NC, check out this #job: https://t.co/RaOnD2oR6m #Hiring #CareerArc",0,0,TweetMyJOBS,2016-01-28 18:46:18,72459685,NC_physician,NC Physician Jobs,2009-09-08 03:21:44,Follow this account for geo-targeted Physician job tweets in North Carolina from TweetMyJobs. Need help? Tweet us at @TweetMyJobs!,156,133,North Carolina,Eastern Time (US & Canada)
45,692777423948136448,"Crip squad sleeps in PE ll, it's what we do. 😂 @ Port Clinton High School https://t.co/1skOfuX7Xa",0,0,Instagram,2016-01-28 18:33:03,2290396298,krusincovitch,Ken,2014-01-14 00:38:17,I like monsters inc & iron man |@riileythomas is my person,858,830,lake livin' & lovin',Eastern Time (US & Canada)
46,692777050659098624,I am looking for a buyer on 401 Hopkins Drive #Clinton #KY https://t.co/PxH2pTOqcV #realestate https://t.co/ZL9traxq2O,0,0,circlepix,2016-01-28 18:31:34,357023803,KWmurrayky,Keller Williams 898,2011-08-17 18:40:07,"Keller Williams Experience Realty-Murray, KY/Paducah, KY
Murray: 270-753-1492
Paducah: 270-450-0827",320,25,"Murray, KY/Paducah, KY",Central Time (US & Canada)
47,692777045261037569,I am looking for a buyer on 401 Hopkins Drive #Clinton #KY https://t.co/ypQID2RMZl #realestate https://t.co/VLSyjh998z,0,0,circlepix,2016-01-28 18:31:33,357023803,KWmurrayky,Keller Williams 898,2011-08-17 18:40:07,"Keller Williams Experience Realty-Murray, KY/Paducah, KY
Murray: 270-753-1492
Paducah: 270-450-0827",320,25,"Murray, KY/Paducah, KY",Central Time (US & Canada)
48,692770481200451584,"We're #hiring! Read about our latest #job opening here: Catalyst Manufacturing Support - https://t.co/WZzybxtEZg #Clinton, NJ",0,0,TweetMyJOBS,2016-01-28 18:05:28,128776507,tmj_NJ_gensci,TMJ-NJ Gen. Science,2010-04-02 04:41:50,Follow this account for geo-targeted General Scientific job tweets in New Jersey Non-Metro from TweetMyJobs. Need help? Tweet us at @TweetMyJobs!,273,257,New Jersey,Quito
49,692769786539806720,Dashing clinton,0,0,Twitter for Android,2016-01-28 18:02:42,2462463840,CherishDenlinge,Cherish Maria mArie,2014-04-25 01:22:12,,23,74,woman,
50,692768848475471874,BBC. Just chatting with Pres. Bill Clinton about Martin Luther and the Wartburg Castle for which… https://t.co/50p1dvgsNZ,0,1,Instagram,2016-01-28 17:58:59,14985534,garnergraham,Graham Garner,2008-06-02 21:41:54,"VP-Marketing & Comm @WartburgCollege. Raised in Idaho, loving Iowa. Harley rider, former journalist, Italophile.",342,418,"Waverly, Iowa",Mountain Time (US & Canada)
51,692766711221583872,"This #Retail #job might be a great fit for you: CSA Front End - https://t.co/WT7LdJ4PE6 #Clinton, MD #Hiring",0,0,TweetMyJOBS,2016-01-28 17:50:29,28439613,tmj_dc_retail,Wash. DC Retail Jobs,2009-04-02 22:48:29,Follow this account for geo-targeted Retail job tweets in DC Metro. Need help? Tweet us at @CareerArc!,489,314,"Washington, DC",Eastern Time (US & Canada)
52,692763923938816000,"#BusinessMgmt #Job alert: Rough End Process Supervisor | Shaw Industries | #Clinton, SC https://t.co/MeKsr7Pr01 #Jobs #Hiring",0,0,SafeTweet by TweetMyJOBS,2016-01-28 17:39:25,903926353,ShawFloorsJobs,Shaw Floors Jobs,2012-10-25 13:34:23,Home of the world's largest carpet manufacturer and thousands of great jobs! Come grow your career with us!,236,11,US and Canada,Eastern Time (US & Canada)
53,692760528360329218,"Interested in a #Hospitality #job near #Clinton, OK? This could be a great fit: https://t.co/Js4bdo3eXK #SONIC #Hiring #CareerArc",0,0,TweetMyJOBS,2016-01-28 17:25:55,88290897,tmj_ok_hrta,TMJ-OK HRTA Jobs,2009-11-07 22:47:26,Follow this account for geo-targeted Hospitality/Restaurant/Tourism job tweets in Oklahoma Non-Metro. Need help? Tweet us at @CareerArc!,356,283,Oklahoma,Eastern Time (US & Canada)
54,692759814661935108,@mitchellreports I can't believe u asked q during the debates bout Bill Clinton's behavior. U could have asked quality policy q. Should quit,0,0,Twitter for Windows Phone,2016-01-28 17:23:05,2804640199,Jane_Steranko,Wizard_of_Id,2014-09-12 00:30:30,"Science is my thing. Trying not park by Braille. I hope my wizardry is less magic but, shared insight and common cause.",1756,1799,,Eastern Time (US & Canada)
55,692759504836898816,"We're #hiring! Read about our latest #job opening here: RN Travel Nurse Registered Nurse - https://t.co/Hfnzv28jY4 #Clinton, MD #Healthcare",0,0,TweetMyJOBS,2016-01-28 17:21:51,20828529,tmj_dc_health,TMJ- WAS Health Jobs,2009-02-14 03:20:30,Follow this account for geo-targeted Healthcare job tweets in DC Metro. Need help? Tweet us at @CareerArc!,438,307,"Washington, DC",Eastern Time (US & Canada)
56,692758504008998914,@John_16_2 @mlcalderone @tedcruz I excuse Clinton? One of us in this convo has talked w/his sec service guys abt his antics &amp; it ain’t you.,0,0,Hootsuite,2016-01-28 17:17:52,630586656,HercFamily5,Uneasy Civilian,2012-07-08 20:41:40,"Oh, I may have a few years in the USAF concluding in the geometric-shaped building. Retired now and back in God's Country #SEC #VFL #GoVols",1355,1712,"Nashville, TN",Eastern Time (US & Canada)
57,692757794886328320,Check out our #listing in #Clinton #KY https://t.co/ypQID2RMZl #realestate #realtor https://t.co/PW0AgVYUyW,0,0,circlepix,2016-01-28 17:15:03,357023803,KWmurrayky,Keller Williams 898,2011-08-17 18:40:07,"Keller Williams Experience Realty-Murray, KY/Paducah, KY
Murray: 270-753-1492
Paducah: 270-450-0827",320,25,"Murray, KY/Paducah, KY",Central Time (US & Canada)
58,692755158959276032,"""@WSJ: Bernie Sanders challenges Hillary Clinton to 3 new debates—and not
on weekends https://t.co/P1CasDwFrZ"" *Rolls Eyes*",0,0,Twitter for BlackBerry,2016-01-28 17:04:35,109456012,JWooTV,J-Woo ™,2010-01-29 03:19:49,"Wannabe Sports Anchor 
Strength Coach 
I am the #FalconsFam #Pelicans 
Life Ain't Fair - Me",841,498,New Orleans / Memphis,Central Time (US & Canada)
59,692750303280525312,"#Clinton, MD #Physician #Job: Physician at MedExpress https://t.co/59crAMI2D2 #Veterans #Jobs #Hiring #CareerArc",0,0,TweetMyJOBS,2016-01-28 16:45:17,71179284,tmj_dc_physici,DC Physician Jobs,2009-09-03 05:15:34,Follow this account for geo-targeted Physician job tweets in DC Metro from TweetMyJobs. Need help? Tweet us at @TweetMyJobs!,113,97,DC Metro,Eastern Time (US & Canada)
60,692747207989022721,RT @PaulNBlake: When in history has an epidemic become so alarming that a nation urges its people not to have kids for 2 years? https://t.c…,162,0,Twitter for iPhone,2016-01-28 16:32:59,1703668724,dev0ski,Devon,2013-08-27 03:56:13,♊️✝. TXSU16 https://t.co/kuxQqGH8C1,320,152,Houston,Central Time (US & Canada)
61,692744603821158400,Someone underperformed @jaketapper @wolfblitzer @RealJamesWoods @greatgroverino @realDonaldTrump https://t.co/1ho1YBbU49,0,0,Twitter for iPhone,2016-01-28 16:22:38,906502502,poppedcollar80,thomas scott jackson,2012-10-26 18:13:43,,58,75,,
62,692743552518848512,"ExxonMobil #internship #Job: 2016 Librarian Intern (#Clinton, NJ) https://t.co/PsWN24JVxp #Jobs #Hiring",0,0,TweetMyJOBS,2016-01-28 16:18:28,117615674,tmj_nj_intern,TMJ-NJ Intern Jobs,2010-02-26 02:36:03,Follow this account for geo-targeted Internships job tweets in New Jersey Non-Metro from TweetMyJobs. Need help? Tweet us at @TweetMyJobs!,384,245,New Jersey,Quito
63,692739376241987585,"Can you recommend anyone for this #job? Med Surg/Tele - https://t.co/3bdo3IbZa9 #Clinton, MD #Nursing #Hiring",0,0,TweetMyJOBS,2016-01-28 16:01:52,234960361,TravelNurseWork,TravelNursesPHP,2011-01-07 00:50:02,Premier Healthcare Professionals is an industry leader in domestic & international healthcare staffing. We have a client base of thousands of hospitals.,4502,4832,"Atlanta, GA",Central Time (US & Canada)
64,692733572101189632,"Interested in a #Hospitality #job near #Clinton, UT? This could be a great fit: https://t.co/25mc4YDPbW #SONIC #Hiring #CareerArc",0,0,TweetMyJOBS,2016-01-28 15:38:48,88304861,tmj_ut_hrta,TMJ-UT HRTA Jobs,2009-11-08 00:05:55,Follow this account for geo-targeted Hospitality/Restaurant/Tourism job tweets in Utah Non-Metro. Need help? Tweet us at @CareerArc!,310,281,Utah,Eastern Time (US & Canada)
65,692732395456327680,"RT @DocTexian: Fox News:
HILLARY CLINTON WILL BE THE NEXT PRESIDENT OF THE UNITED STATES OF AMERICA BUT SHOULD ONLY BE PAID 82 % OF OTHER P…",101,0,Twitter Web Client,2016-01-28 15:34:08,3139144531,Briere32Briere,Sylvie Briere,2015-04-04 14:57:17,"To fear love is to fear life, and those who fear life are already three parts dead",3410,1719,New York,
